title,date,body
党建评：党员干部“三伏”必备“三味”药方,2020-07-27,"三伏天出现在小暑和处暑之间，是一年中气温最高且又潮湿、闷热的日子，湿气容易浸入人体，出现暑热等情况。因此，许多人都想趁三伏，查查病、治治病。同样，党员干部也应该常常“检身自省”，发现自己的问题，备齐“三味”药方，治治病，强强身。
	三伏天的阳气把阴气藏伏地下，才会导致阴阳失调；一些党员干部把理想信念藏在身后，才会蒙蔽初心，迷失方向。被查处的腐败分子，之所以跌入违纪违法的陷阱，从根本上讲就是把初心和使命抛到九霄云外了。初心是引航灯，指引前进的方向。每一名党员干部要回归初心，找到来时路，才能不迷路、走错路。习近平总书记曾强调，初心不会自然保质保鲜，稍不注意就可能蒙尘褪色，久不滋养就会干涸枯萎，很容易走着走着就忘记了为什么要出发、要到哪里去，很容易走散了、走丢了。党员干部要经常进行思想政治体检，以新时代理论武装头脑，同党中央要求“对标”，拿党章党规“扫描”，用人民群众新期待“透视”，同先辈先烈、先进典型“对照”，不断叩问初心、守护初心，不断坚守使命、担当使命，始终做到初心如磐、使命在肩。
	闷热的伏天，人们习惯呆在空调房，享受夏日凉爽。部分党员干部也因思想慵懒，患上了“空调病”，不深入基层调研，不走进农家院坝访民生，不帮助困难群众解决实际问题，遥控指挥，沦为“甩手掌柜”“大概先生”，这是作风漂浮的表现。不熟悉基层实际，制定的政策只会是闭门造车；不清楚群众的想法，研究的举措只会是纸上谈兵。纸上得来终觉浅，绝知此事要躬行。再精准的数字、再精致的材料都只能是表面文章，只有深入基层调研，才能收获“真材实料”。为官一任，造福一方。党员干部要当“店小二”，经常到基层“跑堂”，摸清家底、熟悉情况，问计于民、问需于民，与群众打成一片。党员干部只有对群众所需所盼做到心中有数，才能科学规划，匠心施策，突破发展的“瓶颈”，真正实施好脱贫攻坚、乡村振兴、生态环保等民生工程，改善群众生产生活环境，提高生活质量，实现全面建成小康社会目标。
	三伏天是一年最闷热的日子，人容易情绪化。一些党员干部往往心浮气躁，急躁不安，“这山望着那山高”，把基层当成“跳板”，把挂职当成“镀金”。缺乏务实的工作作风，缺乏党员干部职责的认知。作为党员干部当多一些厚实质朴，少一些能言善道；多一些脚踏实地，少一些花拳绣腿；多一些求真务实，少一些敷衍塞责，不动“歪脑经”、不走“捷径路”，不耍“假把式”，力戒形式主义和官僚主义。“冬练三九，夏练三伏”，艰苦的岁月往往使人进步，使人练就真功夫。当前，正是党员干部用好真功夫的时候，我国多地遭遇洪涝灾害，严重影响着人民的生产和生活，党员干部应在此时深入抗洪一线为百姓排忧解难，方显自身价值。
	既然选择了远方，就只顾风雨兼程。党员干部在脱贫攻坚、乡村振兴、疫情防控、抗洪抢险等没有硝烟的战场上，要当好征战沙场的战士，坚持日饮“当归”“熟地”“厚朴”三味苦口良药，以“功成不必在我”的精神境界和“功成必定有我”的历史担当，发扬钉钉子精神，一战到底。"
今日谈：让社区成为温暖的港湾,2020-07-27,"开发应用智慧社区微信小程序或APP，实施“星级社区”评比，开展域内党组织和在职党员进社区“双报到”……河北省唐山市祥富里社区通过整合资源，既调动了广大党员、干部参与社区建设的积极性，也增强了社区公共服务能力。
	习近平总书记强调，“社区是党和政府联系、服务居民群众的‘最后一公里’”。社区工作千头万绪，但说到底，就是要为民服务、为民办事。路灯亮不亮、下水道堵没堵、环境干不干净，只有从这些“芝麻绿豆”的小事入手，一件件加以解决，才能把工作做到群众心坎上。
	社区工作好不好，基层党组织是关键。在祥富里社区，每一名社区党员的家门口，都挂着一块红彤彤的“共产党员户”牌子。对于社区党员而言，这既是鞭策，也是引导。每名党员贡献“一点红”，就能汇成社区的“党旗红”。以党建引领社区治理，发挥党员先锋模范作用，我们就能让党的旗帜在社区群众心目中高高飘扬，让社区成为温暖的港湾。"
人民论坛：加劲冲刺，决胜“最后一公里”,2020-07-23,"时间是万物的尺度，也丈量着我们迈向全面小康的步履。当前，广大扶贫干部尽锐出战，成为跑好脱贫攻坚“最后一公里”的中坚力量。“上万名贫困群众亟待返岗，缓不得、等不起”“我要站好最后一班岗”“市挂牌，县督战，我们有压力更有动力”……朴实的话语，写照着争分夺秒、苦干实干的劲头，传递着行则将至、做则必成的信心。
	习近平总书记深刻指出，打好脱贫攻坚战，关键在人，在人的观念、能力、干劲。摆脱贫困的征程上，中华民族已越过层层峰峦，再进一步就能迎来梦想成真的高光时刻。然而，在最后的冲刺跑中，仍有贫中之贫、困中之困的障碍，还有数百万人存在返贫致贫风险，更有疫情叠加、双线作战的考验。越是关键时刻，越需要激发斗志；越是任务艰巨，越需淬炼队伍。紧紧抓住“人”这个关键要素，充分调动广大党员干部的积极性、主动性、创造性，方能跑好关键一程，以实绩赢得百姓认可。
	人是生产力中最重要的因素，人的观念是实践的先导。党员干部的思想认识水平和实际工作能力，影响着扶贫工作的成效。在脱贫攻坚战的收官阶段，既要看到任务的艰巨性、风险性，更要看到成功的现实性、必然性。坚持人民至上的崇高理念，初心如磐、使命在肩，就能让脱贫事业更好造福群众。
	面对脱贫攻坚这项点多面广线长的系统工程，学习永无止境，能力更无上限。从政策宣传到调查研究，从产业发展到精准帮扶，哪里有短板、有盲区，哪里就需要我们通过学习补齐短板、减少盲区。不久前，云南省18万余名扶贫干部通过在线课堂“云充电”，聚焦重点难点进行学习，力争使扶贫工作帮到点上、扶到根上。冲刺期就是提高本领的黄金期，脱贫战场正是增长才干的练兵场。全方位提升工作能力，成为联系群众的贴心人、带动发展的领头羊、专业技能的好把式，这是攻坚克难、拔除穷根的实际需要。
	目标在前、使命催征，惟有实干笃行。申纪兰老人曾带领西沟村民在土坷垃里刨出粮食，靠奋斗过上了好日子。她感慨：我是太阳底下晒出来的，不是办公室里坐出来的。扶贫不在嘴皮上、表格中、文件里，而在工厂车间的生产线上、直播带货的信息流中、易地搬迁的施工现场。出实绩、见实效，必须拿出真抓的实劲、敢抓的狠劲、善抓的巧劲、常抓的韧劲，硬碰硬去闯、实打实去干，向贫困堡垒发起总攻。以实干引领实干，用担当带动担当，才能激扬敢于斗争、勇于冲锋的精气神，为战胜贫困凝聚起更强大的合力。
	“凡作事，将成功之时，其困难最甚。”坚定必胜的信心，激发顽强的斗志，慎终如始、蓄力奔跑，永不懈怠、一往无前，我们就一定能锻造更加坚强的队伍，创造更加光辉的业绩。"
属地管理，也要层层负责,2020-07-21,"“厘清不同层级、部门、岗位之间的职责边界，按照权责一致要求，建立健全责任清单，科学规范‘属地管理’，防止层层向基层转嫁责任。”中办印发的《关于持续解决困扰基层的形式主义问题为决胜全面建成小康社会提供坚强作风保证的通知》，为推动基层减负工作取得实效注入新动力。
	属地管理，通俗地说就是谁的辖区谁负责，有利于明确责任落实，确保各项决策部署在基层贯彻执行，也有利于强化源头治理，推进问题解决在基层，矛盾化解在基层。可是近年来，一些地方和部门以“属地管理”为由，把自身应承担的工作推给基层，一旦出现问题，统统由基层承担责任。对此，基层不堪重负。
	比如，有基层同志反映，“‘属地管理’是个筐，什么都可以往里装。”有的乡镇一年签订的责任状、任务书多达四五十份。再如，原本大家一起干，现在只有自己干，有些部门还理直气壮催着干。而面对很多工作任务，一些基层单位既无能力也无权力，根本担不起、扛不住。
	上面千条线，下面一根针，基层是政策落实的“最后一公里”，相关地方和部门如果层层向基层转嫁责任，看似层层压实责任，实则层层不负责任；看似工作有了着落，结果往往是影响了工作进展。这是一种典型的形式主义、官僚主义。并且，承接上级转嫁的责任多了，自然挤占了基层干部的时间、精力，加重了工作负担，甚至影响到基层本职工作。倘若因此被约谈、问责甚至处分，更会凉了基层干部的心。还有些基层干部产生麻木心态，问责的严肃性也就打了折扣。
	因此，问责只是管理手段之一，层层负责才是干事创业的应有态度，才能真正为基层减负。当前，各级党委政府应根据中办《通知》要求，加强制度建设，明确职责分工，拧紧责任链条。对于确需下放到基层的工作，要严格按照制度、程序审核把关，既要明确责任也要下放权力。随意转嫁责任、“甩包袱”，本质上是不担当、不作为，是失职失责，对此要坚决防范遏制。
	一方面是防止层层转嫁责任，一方面要伸出关心帮助的手。当前，无论是决胜全面建成小康社会、决战脱贫攻坚，还是统筹推进疫情防控和经济社会发展，抑或是乡村振兴、生态文明、社会治安、民生服务，都需要广大基层干部恪尽职守、担当作为。同时，基层开展有效治理，也离不开各方面的支持和保障。各地各部门应进一步转变工作理念，改进工作方式，沉下身子、甩开膀子，通过重心下移、资源下移，指导和帮助基层解决实际困难，推动完善基层治理体系。基层夯实了，各方面工作落实才会更有力。"
人民论坛：让党旗在防汛救灾第一线高高飘扬,2020-07-20,"江河告急！汛情紧急！连日来，受持续性降雨影响，多地江河湖泊水位超警戒，洪水集中来袭。我国多个省份发生洪涝灾害，给人民生命财产安全带来威胁，给群众正常生产生活造成影响。
	7月17日，习近平总书记主持召开中共中央政治局常委会会议，研究部署防汛救灾工作。会议指出，各级领导干部要深入一线、靠前指挥、现场督查，在防汛救灾第一线体现责任担当，组织广大干部群众众志成城、顽强奋斗；各级党委和政府要担负起促一方发展、保一方平安的政治责任，基层党组织和广大党员、干部要充分发挥战斗堡垒作用和先锋模范作用，主动担当、敢打头阵，紧紧依靠人民群众，把党的政治优势、组织优势、密切联系群众优势转化为防汛救灾的强大政治优势，让党旗在防汛救灾第一线高高飘扬。
	我国是世界上水情最为复杂、江河治理难度最大、治水任务最为繁重的国家之一。习近平总书记强调：“防汛救灾关系人民生命财产安全，关系粮食安全、经济安全、社会安全、国家安全。”对各级党组织和广大党员干部来说，防汛救灾也是一场大战大考。暴雨接连来袭，洪水漫过江堤……危急关头，既考验防灾救灾体系和应急管理能力，也检验责任担当和为民情怀。越是险情当前，越照见党员干部的责任担当。汛情就是命令，必须闻“汛”而动，迎难而上。
	哪里有汛情，哪里就有冲锋陷阵的身影；哪里有危险，哪里就有叩击心灵的担当。“巡堤，既是为国家，也是为自己的小家。”湖南沅江，53岁的党员黄昌明提着铁锨，带领村民昼夜巡堤。“只要群众需要，我就义无反顾。”浙江衢州，第三年参与抗洪抢险的民警程利丰，已经记不清自己究竟出了多少次警。“遇到危险，第一反应就是向前冲。”“洪水不退，我不退！”防汛救灾战场上，无数共产党员冲锋在前、挺在一线，激励和带领广大群众筑起防汛救灾的责任堤坝。
	关键时刻冲得上去、危难关头豁得出来，才是真正的共产党人。回溯历史，从轰轰烈烈的革命战争年代，到激情燃烧的社会主义建设时期，再到波澜壮阔的改革开放大潮涌起，无论时代如何变迁，共产党人的初心永不改，共产党人的担当最有力。汛情当前，守初心、担使命是具体的，要求我们坚持人民至上、生命至上，压实责任、勇于担当，用实际行动全力保障人民生命财产安全。
	近日，中央组织部专门印发通知，要求在防汛救灾中充分发挥基层党组织战斗堡垒作用和广大党员先锋模范作用。防汛救灾一线，淬炼过硬作风，也最能考察识别干部。眼下，我们既要统筹做好疫情防控和抢险救灾工作，严格落实各项防控措施，避免疫情出现反弹，又要统筹灾后恢复重建和脱贫攻坚工作，对贫困地区和受灾困难群众给予支持，防止因灾致贫返贫，任务十分艰巨繁重。恪尽职守、攻坚克难，身先士卒、争做表率，应是每一名党员干部的思想自觉、行动自觉。
	一幅新闻照片，打动人心：经过连续奋战，江西鄱阳中洲圩决口处成功实现合龙；霎时间，圩堤上迎风招展的一面面红旗，映红了连绵无际的水面。“早已森严壁垒，更加众志成城”。面对十分严峻的防汛形势，让党旗在防汛救灾第一线高高飘扬，不畏艰险、战风斗浪，我们必将带领群众筑起战胜洪水的铜墙铁壁，为决胜全面小康、决战脱贫攻坚凝聚更昂扬的精气神。"
人民论坛：始终把保障人民生命财产安全放在第一位,2020-07-20,"当前，全国防汛进入“七下八上”阶段，多地发生洪涝地质灾害，防汛形势十分严峻。7月17日，中共中央政治局常委会召开会议，研究部署防汛救灾工作。习近平总书记主持会议并发表重要讲话，强调防汛救灾关系人民生命财产安全，关系粮食安全、经济安全、社会安全、国家安全，各有关地区、部门和单位要始终把保障人民生命财产安全放在第一位，采取更加有力措施，切实做好防汛救灾各项工作。
	汛情就是命令，防汛就是责任。入汛以来，在党中央坚强领导下，各地紧急行动，团结奋战，始终坚持人民至上、生命至上，凝聚起防汛抗洪、抢险救灾的强大合力。
	这是舍我其谁的责任担当。在防汛抗洪的主战场，党组织是战斗在最前沿的坚强堡垒，党员是冲在第一线的先锋表率。“你不走，我不走”，基层干部的劝解中饱含与群众共进退的为民情怀；“你的损失，我也心疼”，46岁党员跳进齐肩积水中，为葡萄种植户疏通排水口险情；“你若不便，我背你一程”，乡镇干部以背为“桥”，为老人、孩子充当摆渡者……堤坝一线、安置现场、灾后重建的街巷村头，党旗飘飘，党徽闪耀，广大党员干部主动担当、敢打头阵，让老百姓吃下“定心丸”，有了战胜洪水、恢复生产、重建家园的信心和勇气。
	这是向险而行的大无畏精神。哪里有危险，哪里就有人民解放军指战员、武警官兵、公安干警和消防救援队伍指战员。不让安徽歙县学生因洪水缺席高考，人民子弟兵连夜搭起两座浮桥，24小时待命值守。企业受灾，武警黄山支队火速前往，帮助整理设施、清理厂房，开展灾后重建工作。出现漫堤、管涌，江西永修县消防员彻夜围堵洪水18个小时，双手伤痕累累、双脚浸泡得发白。转移群众，维持秩序，公安干警冲在前面。在抗洪救灾的现场，他们以铿锵行动践行着铮铮誓言，把洪水挡在身后，把安全送到群众身边。
	这是守望相助的团结力量。保卫家园，谁都不是旁观者。无论是刚下高考考场就奔赴防汛“战场”的周亮宇，还是感恩九八抗洪中得救、在得知防汛需要增派人手立马报名上堤的汪晗，抑或是在一句“家乡需要你”召唤下回乡驰援的江西九江江洲镇近3000名当地群众，无数挺身而出的普通市民最让人动容。在前方，“洪水不退，我们不撤”的誓言掷地有声；在后方，筹集物资、疏散转移环环接力，共守“生命之堤”。
	一家有难邻里相助，一处受灾齐伸援手，在各方同心协力中，防汛救灾工作有序有力推进，取得了积极成效。事实证明，灾情只会让中国人民更加团结，磨难只会让民族精神更加高扬。面对严峻形势，各级党委和政府要认真贯彻落实习近平总书记重要讲话、重要指示批示精神和党中央决策部署，全面落实防汛救灾主体责任，加强组织领导和责任落实，坚持预防预备和应急处突相结合，加强统筹协调，强化协同配合，抓实抓细防汛救灾各项措施。各有关地区都要做好预案准备、队伍准备、物资准备、蓄滞洪区运用准备，宁可备而不用，不可用时无备。各有关方面要加强统筹协调，发挥各自专业优势，形成省市间、部门间、军地间、上下游、左右岸通力协作的防汛救灾格局。各级领导干部要深入一线、靠前指挥、现场督查，在防汛救灾第一线体现责任担当，组织广大干部群众众志成城、顽强奋斗。
	今年是决胜全面建成小康社会、决战脱贫攻坚之年，也是“十三五”规划收官之年，做好防汛救灾工作十分重要。坚持一切为了人民、紧紧依靠人民，让党旗在防汛救灾第一线高高飘扬，汇聚起战胜洪水的磅礴力量，我们就一定能打赢防汛救灾这场硬仗，朝着既定目标风雨无阻向前进。"
党建评：“四力”合璧提升干部治理能力,2020-07-17,"党的十九届四中全会《决定》提出：“把提高治理能力作为新时代干部队伍建设的重大任务。”在此次新冠肺炎疫情“大考”中，基层治理体系短板逐渐暴露，干部治理能力弱项也随之显现，这对我们打造忠诚干净担当的高素质专业化干部队伍，提出了更高要求。
	政治路线确定之后，干部就是决定因素。干部队伍治理能力，事关坚持和完善中国特色社会主义制度，事关推进国家治理体系和治理能力现代化大局。必须把“突出提高治理能力”作为一项重要政治任务来抓，引导广大干部强化制度意识，提高执政水平，努力成为懂治理、能治理、善治理的行家里手。
	推进国家治理体系和治理能力现代化，是各级党组织和广大党员干部的职责使命。把牢思想之舵、站稳政治立场，方能把准国家治理和社会治理的正确方向。要把学习贯彻习近平新时代中国特色社会主义思想作为头等大事，教育引导党员干部学深悟透、躬身实践，在地区建设发展实践中强化干部政治训练、政治历练和政治监督，全面落实领导干部政治素质考察要求，推动干部增强“四个意识”、坚定“四个自信”、做到“两个维护”。要强化培养培训，严格落实习近平新时代中国特色社会主义思想培训计划，结合疫情实际，采用“云端课堂”等模式，举办学习贯彻党的十九届四中全会精神专题培训班，让干部深刻领会党的创新理论、先进治理理念和科学治理方法，推动学习成果向治理能力转化。
	人在事上练，刀在石上磨。干部的治理能力不会凭空产生，需要丰富的实践历练和过硬的专业技能作为支撑。要坚持实践标准，评价干部时不简单看专业背景，更要看“干过什么、干成过什么”，在全面审视干部专业知识、专业能力、专业作风、专业精神的基础上，坚持“培训充电”和“实践蓄能”双轮驱动，引导干部在党建引领物业管理、城乡基层治理、产业转型发展等实践中，更新知识结构、拓宽眼界视野，不断提升现代化、精细化治理水平。要加大干部交流力度，积极选派干部参加疫情防控、防汛救灾、脱贫攻坚等重大任务，依托农村、国企、教育、卫生、“两新”组织等领域平台，组织干部开展“大培训、大挂职、大练兵、大比武”，进一步提升干部的制度执行力和基层治理能力。
	精神状态好不好、工作热情高不高、治理效果实不实，是衡量干部治理能力的重要因素。当前，疫情防控进入常态化阶段，脱贫攻坚已到攻城拔寨的关键时刻，迫切需要广大干部加满油、鼓足劲，攻坚克难、善作善成。要牢固树立重实干、重实绩、重担当的选人用人导向，把制度执行力和治理能力作为干部选拔任用、考核评价的重要指标，用好“贴近式”考察等举措，通过提拔一批、引进一批、储备一批、交流一批敢担当、善作为的干部，激发干部队伍整体活力。要加强关心关爱，综合运用评优评先、职级晋升、谈心谈话、心理疏导等手段，挖掘、选树一批基层社会治理典型，千方百计为干部纾解疑难、解决后顾之忧，促进干部在基层治理的实践中安心安业、建功立业。
	群众工作是国家治理、社会治理的基础性工作，也是每一名干部都应练好的基本功。检验干部治理能力的高低，最终要以群众的认可度和满意度为准绳。要持续笃定为民初心，把“治理为民”作为根本出发点，以贯彻落实不忘初心、牢记使命制度为抓手，教育引导党员干部牢固树立“以人民为中心”的发展思想，进一步校准自身政绩观和事业观，不断在基层治理中深入群众、服务群众，让人民群众享受更多福祉。要聚焦民生精准发力，做实党建引领“吹哨报到”“接诉即办”等机制，探索“小支部、大党建”“小门楼、大作为”等模式，推动治理政策、治理资源、治理力量向一线下沉，引导干部接地气、通下情、听民声，不断解决群众“家门口”的事，切实打通基层社会治理“最后一公里”。"
