title,date,body
人民观点：人无精神则不立，国无精神则不强,2020-09-11,"在全国抗击新冠肺炎疫情表彰大会上，习近平总书记深入阐述了“生命至上、举国同心、舍生忘死、尊重科学、命运与共”的伟大抗疫精神，激发起亿万人民同舟共济、攻坚克难的强大力量。从今天起，本版推出系列评论文章，与读者一起深入学习领会、共同践行伟大抗疫精神。
	
	
	
	全国抗击新冠肺炎疫情表彰大会举行之际，一段视频在网上刷屏。长安街上，钟南山、张伯礼、张定宇、陈薇四位抗疫英雄乘坐礼宾车，在国宾护卫队的护卫下前往人民大会堂。网友纷纷留言：最高礼遇！以国之名，致敬！国家表彰的，是一种悬壶济世、舍己为人的责任担当；人们致敬的，是一种敢于牺牲、无私奉献的精神境界。
	人无精神则不立，国无精神则不强。在表彰大会上，习近平总书记的话语铿锵有力：“在这场同严重疫情的殊死较量中，中国人民和中华民族以敢于斗争、敢于胜利的大无畏气概，铸就了生命至上、举国同心、舍生忘死、尊重科学、命运与共的伟大抗疫精神。”伟大抗疫精神，同中华民族长期形成的特质禀赋和文化基因一脉相承，是爱国主义、集体主义、社会主义精神的传承和发展，是中国精神的生动诠释，丰富了民族精神和时代精神的内涵。
	惟其艰难，才更显勇毅；惟其笃行，才弥足珍贵。作为一种难以预知的天灾，新冠病毒让人类措手不及。与这个“新型的未知病毒”作斗争，难度堪称前所未有：如何在对病毒知之甚少甚至一无所知的时候开展防控？如何在人员大规模流动的春节假期阻断病毒？如何收治数目庞大的新冠肺炎患者？……有人形象地说，中国参加了一场突如其来的“闭卷考试”。但超乎想象的困难，并没有压倒中国人民，反而激发起敢于斗争、敢于胜利的精气神。伟大抗疫精神之所以伟大，因为它是战风斗雨凝结而成的，是无数人攻坚克难沉淀而来的。当一个人拥有了这样的精神，必将信心满怀、步履坚定；当一个国家拥有了这样的精神，必将众志成城、战无不胜。
	同困难作斗争，是物质的角力，也是精神的对垒。在最艰难的时刻，伟大抗疫精神汇聚起强大力量。这是一种面对困难时无所畏惧的信念。“若有战，召必回，战必胜”，南方医科大学南方医院医疗队主动请战，誓言铿锵；“备战有我！冲锋有我！胜利有我！”湖南中医药大学第一附属医院的共产党员，决心坚定。这是一种经历风雨时勇往直前的行动。年逾八旬的钟南山院士挤上高铁餐车，星夜兼程，赶赴武汉；张定宇在自己身患渐冻症、妻子感染的情况下，仍战斗在与病毒斗争的第一线。这是一种战胜风险时守望相助的温情。武汉快递小哥汪勇在疫情防控期间自发接送上下班的医务人员，并送上热腾腾的盒饭；一位“90后”项目工程师，瞒着父母奔赴雷神山医院建设工地。不分男女老幼，不分工作岗位，14亿人无所畏惧战病毒、齐心协力斗疫魔，充分展现了中国精神、中国力量、中国担当。凭借这样的精神，有什么困难不能战胜，又有什么胜利不能赢取？
	惟有精神上站得住、站得稳，一个民族才能在历史洪流中屹立不倒、挺立潮头。在疫情防控期间，“武汉必胜、湖北必胜、中国必胜”的强音响彻中华大地，这是一个国家挺立于灾难的姿态，这是一个民族无惧于挑战的自信。现在，疫情仍在全球蔓延，国内零星散发病例和局部暴发疫情的风险仍然存在，夺取抗疫斗争全面胜利还需要付出持续努力。从更大层面来看，当今世界正经历百年未有之大变局，我国发展的内部条件和外部环境正在发生深刻复杂变化，我们将面对更多逆风逆水的外部环境。当此滚石上山、爬坡过坎之际，最需要激发精神的力量、坚定必胜的信心，伟大抗疫精神为此提供了重要的思想资源。在全社会大力弘扬伟大抗疫精神，就是要激发起亿万人民战胜一切风险挑战的斗志，使之转化为全面建设社会主义现代化国家、实现中华民族伟大复兴的强大力量，为实现既定奋斗目标注入不竭动力。
	进入9月，武汉约140万名中小学、幼儿园学生开学，安静了许久的校园又重新响起“上课”“起立”“老师好”的声音。那个富有生机活力的武汉又回来了。这是一座英雄的城市。弘扬伟大抗疫精神，让顽强拼搏、不屈奋斗激荡在每个人心间，我们就一定能以不可阻挡的磅礴气势，战胜前进路上的一切风险挑战，实现中华民族伟大复兴的中国梦。"
人民论坛：汲取众志成城的奋进力量,2020-09-11,"“革命就像火一样，任凭大雪封山，鸟兽藏迹，只要我们有火种，就能驱赶严寒，带来光明和温暖。”在中国人民抗日战争暨世界反法西斯战争胜利75周年之际，我们重温胜利历史，追溯胜利根源，汲取众志成城、排除万难、一往无前的奋进力量，任何人任何势力都不能阻挡中国人民实现更加美好生活的前进步伐。
	在艰苦卓绝的抗日战争中，全体中华儿女为国家生存而战、为民族复兴而战、为人类正义而战，社会动员之广泛，民族觉醒之深刻，战斗意志之顽强，必胜信念之坚定，都达到了空前的高度。中华民族万众一心、众志成城，为抵御外来侵略、维护民族独立顽强抗争、浴血奋战，谱写了全体中华儿女�哿ν�心、以弱胜强的雄浑史诗。正义战胜邪恶、光明战胜黑暗、进步战胜反动，战场上较量的不仅是军事实力和经济实力，更有民族精神和国民意志。杨靖宇、赵尚志、左权、彭雪枫、佟麟阁、赵登禹、张自忠、戴安澜……一个个大义凛然的名字，一个个血染沙场的忠魂，永远为历史和后人所铭记。
	回望历史，日本对华持续侵略是近代以来中国历史上最黑暗的一页。“莽莽神州，已倒之狂澜待挽；茫茫华夏，中流之砥柱伊谁？”在民族危亡的历史关头，中国共产党人勇敢战斗在抗日战争最前线，支撑起中华民族救亡图存的希望，成为全民族抗战的中流砥柱。正如习近平总书记在纪念中国人民抗日战争暨世界反法西斯战争胜利75周年座谈会上深刻指出的：“中国人民抗日战争胜利是中国共产党发挥中流砥柱作用的伟大胜利”“中国共产党坚持动员人民、依靠人民，推动形成了全民族抗战的历史洪流”。解民于倒悬，扶大厦之将倾，中国共产党高举抗日民族统一战线的旗帜，坚决维护、巩固、发展统一战线，坚持独立自主、团结抗战，维护了团结抗战大局，让中国人民抱定了“我们万众一心，冒着敌人的炮火前进”的决心，抱定了血战到底、抗战到底的信念。
	在中国人民抗日战争的壮阔进程中，形成了伟大的抗战精神，这是一笔弥足珍贵的精神财富，将永远激励中国人民克服一切艰难险阻、为实现中华民族伟大复兴而奋斗。抗战胜利75年来，从白手起家建设新中国，到实行伟大的改革开放，再到决胜全面小康、决战脱贫攻坚，中国取得的令世人瞩目的发展成就，是中国人民在中国共产党领导下同心同德、同心同向努力的结果。从抵御地震、洪水等自然灾害，到应对国际金融危机，再到抗击非典、新冠肺炎等重大疫情，中华民族不断战胜前进道路上各种各样的风险挑战、荆棘坎坷，靠的就是压倒一切困难而不为困难所压倒的决心和勇气。“天地英雄气，千秋尚凛然。”抗战先烈永远值得后人缅怀，抗战精神永远值得后世传承。
	今天的中国，正处于实现中华民族伟大复兴关键时期，改革发展正处在攻坚克难的重要阶段。在新时代继承和弘扬伟大抗战精神，以“同心同德一戎衣”的情怀共同奋斗，以越是艰险越向前的精神奋勇搏击，定能跨越一切艰难险阻，不断从胜利走向新的胜利。“历史必将证明，中华民族走向伟大复兴的历史脚步是不可阻挡的。”"
人民日报评论员：大力弘扬伟大抗疫精神,2020-09-11,"“在这场同严重疫情的殊死较量中，中国人民和中华民族以敢于斗争、敢于胜利的大无畏气概，铸就了生命至上、举国同心、舍生忘死、尊重科学、命运与共的伟大抗疫精神。”在全国抗击新冠肺炎疫情表彰大会上，习近平总书记精辟概括并深入阐释了伟大抗疫精神，强调要在全社会大力弘扬伟大抗疫精神，使之转化为全面建设社会主义现代化国家、实现中华民族伟大复兴的强大力量。
	面对突如其来的严重疫情，中国人民风雨同舟、众志成城，不仅构筑起疫情防控的坚固防线，创造了人类同疾病斗争史上又一个英勇壮举，也铸就了伟大抗疫精神，书写了人类精神所演绎的又一个动人篇章。“为了保护人民生命安全，我们什么都可以豁得出来！”这是中国共产党执政为民理念的最好诠释，这是中华文明人命关天的道德观念的最好体现，这也是中国人民敬仰生命的人文精神的最好印证。面对生死考验，面对长时间隔离带来的巨大身心压力，广大人民群众生死较量不畏惧、千难万险不退缩，以各种方式为疫情防控操心出力，绘就了团结就是力量的时代画卷。“危急时刻，又见遍地英雄”，各条战线的抗疫勇士临危不惧、视死如归，困难面前豁得出、关键时刻冲得上，以生命赴使命，用大爱护众生。面对前所未知的新型传染性疾病，我们秉持科学精神、科学态度，把遵循科学规律贯穿到决策指挥、病患治疗、技术攻关、社会治理各方面全过程，为战胜疫情提供了强大科技支撑。“大道不孤，大爱无疆”，我们发起了新中国成立以来援助时间最集中、涉及范围最广的紧急人道主义行动，为全球疫情防控注入源源不断的动力，充分展示了讲信义、重情义、扬正义、守道义的大国形象，生动诠释了为世界谋大同、推动构建人类命运共同体的大国担当。生命至上、举国同心、舍生忘死、尊重科学、命运与共，中国人民和中华民族铸就的伟大抗疫精神，成为坚决打赢疫情防控人民战争、总体战、阻击战的强大精神支撑。
	生命至上，集中体现了中国人民深厚的仁爱传统和中国共产党人以人民为中心的价值追求；举国同心，集中体现了中国人民万众一心、同甘共苦的团结伟力；舍生忘死，集中体现了中国人民敢于压倒一切困难而不被任何困难所压倒的顽强意志；尊重科学，集中体现了中国人民求真务实、开拓创新的实践品格；命运与共，集中体现了中国人民和衷共济、爱好和平的道义担当。习近平总书记对伟大抗疫精神的概括与阐释，深刻阐明了我们党团结带领全国各族人民进行这场惊心动魄抗疫大战的精神实质，深刻揭示了全国抗疫斗争取得重大战略成果的力量源泉。中国人民和中华民族铸就的伟大抗疫精神，同中华民族长期形成的特质禀赋和文化基因一脉相承，是爱国主义、集体主义、社会主义精神的传承和发展，是中国精神的生动诠释，丰富了民族精神和时代精神的内涵，筑起了中华民族伟大复兴征程上新的精神丰碑，成为中华民族最可宝贵的精神财富。
	人无精神则不立，国无精神则不强。唯有精神上站得住、站得稳，一个民族才能在历史洪流中屹立不倒、挺立潮头。同困难作斗争，是物质的角力，也是精神的对垒。当前，世界百年未有之大变局加速演进，国内改革发展稳定任务艰巨繁重，在前进道路上，我们仍然会面临各种各样的风险挑战，会遇到各种各样的荆棘坎坷，实现伟大梦想必须进行伟大斗争。站在“两个一百年”奋斗目标的历史交汇点上，我们要大力弘扬伟大抗疫精神，坚定斗争意志，以越是艰险越向前的气魄奋勇搏击、迎难而上，骨头要硬，敢于出击，敢战能胜，克服一切艰难险阻，在全面建设社会主义现代化国家的新征程上创造新的更大奇迹。"
人民日报评论员：奋勇前进 在新征程上创造新的历史伟业,2020-09-10,"一场惊心动魄的抗疫大战，一场艰苦卓绝的历史大考！在过去8个多月时间里，我们党团结带领全国各族人民，敢于斗争、敢于胜利，取得抗击新冠肺炎疫情斗争重大战略成果，创造了人类同疾病斗争史上又一个英勇壮举。
	9月8日，全国抗击新冠肺炎疫情表彰大会在北京隆重举行。习近平总书记在大会上发表重要讲话，高度评价抗疫斗争重大战略成果，精辟概括并深刻阐发中国人民和中华民族在这场严峻斗争中铸就的伟大抗疫精神，深入总结抗疫斗争伟大实践的经验和启示，明确提出在历史交汇点上不断开创党和国家事业发展新局面的工作要求，具有很强的政治性、思想性、指导性，必将鼓舞和激励我们在新时代新征程上披荆斩棘、奋勇前进，为实现“两个一百年”奋斗目标、实现中华民族伟大复兴的中国梦而不懈奋斗。
	病毒突袭而至，疫情来势汹汹。面对突如其来的严重疫情，以习近平同志为核心的党中央统揽全局、果断决策，习近平总书记亲自指挥、亲自部署，坚持人民至上、生命至上，以非常之举应对非常之事，迅速打响疫情防控的人民战争、总体战、阻击战，经过艰苦努力，付出巨大牺牲，夺取了全国抗疫斗争重大战略成果。在此基础上，我们统筹推进疫情防控和经济社会发展工作取得显著成效，我国成为疫情发生以来第一个恢复增长的主要经济体，在疫情防控和经济恢复上都走在世界前列，显示了中国的强大修复能力和旺盛生机活力。面对突如其来的严重疫情，中国本着公开、透明、负责任的态度，积极履行国际义务，同世界各国携手合作、共克时艰，以实际行动帮助挽救了全球成千上万人的生命，以实际行动彰显了中国推动构建人类命运共同体的真诚愿望。这场艰苦卓绝的抗疫斗争，充分诠释了中国精神、中国力量、中国担当。
	全国抗疫斗争取得重大战略成果，充分展现了中国共产党领导和我国社会主义制度的显著优势，充分展现了中国人民和中华民族的伟大力量，充分展现了中华文明的深厚底蕴，充分展现了中国负责任大国的自觉担当，极大增强了全党全国各族人民的自信心和自豪感、凝聚力和向心力。在这场同严重疫情的殊死较量中，中国人民和中华民族以敢于斗争、敢于胜利的大无畏气概，铸就了生命至上、举国同心、舍生忘死、尊重科学、命运与共的伟大抗疫精神。这一伟大精神，同中华民族长期形成的特质禀赋和文化基因一脉相承，是爱国主义、集体主义、社会主义精神的传承和发展，是中国精神的生动诠释，丰富了民族精神和时代精神的内涵，必将成为全面建设社会主义现代化国家、实现中华民族伟大复兴的强大力量。
	当前，世界百年未有之大变局加速演进，国内改革发展稳定任务艰巨繁重。站在“两个一百年”奋斗目标的历史交汇点上，各级党委和政府要把思想和行动统一到习近平总书记重要讲话精神和党中央决策部署上来，全面贯彻党的基本理论、基本路线、基本方略，坚持稳中求进工作总基调，坚定不移贯彻新发展理念，着力构建新发展格局，统筹国内国际两个大局，办好发展安全两件大事，推进国家治理体系和治理能力现代化，不断开创党和国家事业发展新局面。要按照习近平总书记提出的明确要求，毫不放松抓好常态化疫情防控，奋力夺取抗疫斗争全面胜利；扎实做好“六稳”工作、全面落实“六保”任务，确保完成决胜全面建成小康社会、决战脱贫攻坚目标任务；加快补齐治理体系的短板弱项，为保障人民生命安全和身体健康夯实制度保障；秉持人类命运共同体理念，同国际社会携手应对日益严峻的全球性挑战；坚持底线思维、增强忧患意识，有效防范和化解前进道路上的各种风险，不断夺取具有许多新的历史特点的伟大斗争新胜利。
	一个民族之所以伟大，根本就在于在任何困难和风险面前都从来不放弃、不退缩、不止步，百折不挠为自己的前途命运而奋斗。从5000多年文明发展的苦难辉煌中走来的中国人民和中华民族，必将在新时代的伟大征程上一路向前，任何人任何势力都不能阻挡中国人民实现更加美好生活的前进步伐！让我们更加紧密地团结在以习近平同志为核心的党中央周围，大力弘扬伟大抗疫精神，�哿ν�心、锐意进取，奋力实现决胜全面建成小康社会、决战脱贫攻坚目标任务，在全面建设社会主义现代化国家的新征程上创造新的历史伟业！"
人民日报评论员：必须坚持斗争精神  越是艰险越向前,2020-09-09,"“任何人任何势力企图通过霸凌手段把他们的意志强加给中国、改变中国的前进方向、阻挠中国人民创造自己美好生活的努力，中国人民都绝不答应！”在纪念中国人民抗日战争暨世界反法西斯战争胜利75周年座谈会上，习近平总书记深刻论述中国人民抗日战争胜利是以爱国主义为核心的民族精神的伟大胜利，深刻指出在前进道路上我们面临的重大斗争不会少，我们必须以越是艰险越向前的精神奋勇搏击、迎难而上，强调实现中华民族伟大复兴，必须坚持斗争精神。
	“未惜头颅新故国，甘将热血沃中华。”在艰苦卓绝的抗日战争中，全体中华儿女为国家生存而战、为民族复兴而战、为人类正义而战，社会动员之广泛，民族觉醒之深刻，战斗意志之顽强，必胜信念之坚定，都达到了空前的高度。面对民族存亡的空前危机，面对极其野蛮、极其残暴的日本军国主义侵略者，中国人民以铮铮铁骨战强敌、以血肉之躯筑长城、以前仆后继赴国难，历经14年艰苦卓绝、不屈不挠的斗争，取得了近代以来中国抗击外敌入侵的第一次完全胜利，谱写了惊天地、泣鬼神的雄壮史诗。这一伟大胜利充分证明，中国人民和中华民族具有不畏强暴、敢于压倒一切敌人而不被敌人所压倒的英雄气概，爱国主义是引领中国人民和中华民族迸发排山倒海历史伟力、战胜前进道路上一切艰难险阻的壮丽旗帜！
	踏平坎坷成大道，历尽艰险再出发。中国共产党和中国人民是在斗争中成长和壮大起来的，斗争精神贯穿于中国革命、建设、改革各个时期。我们党诞生于国家内忧外患、民族危难之时，一出生就铭刻着斗争的烙印，一路走来就是在斗争中求得生存、获得发展、赢得胜利。新中国成立不到一年，美国就发动朝鲜战争，把战火烧到鸭绿江边，百废待兴的新中国不畏强敌，以抗美援朝一战打出了人民共和国的国威，打出了人民军队的军威，也捍卫了建立新中国的伟大成果。改革开放之初，我们党带领人民以“杀出一条血路”的斗争精神，披荆斩棘、敢闯敢试，闯出了一条中国特色社会主义新路，创出了一片繁荣发展的新天地。党的十八大以来，以习近平同志为核心的党中央以巨大的政治勇气和强烈的责任担当，励精图治、激浊扬清，意识形态领域正本清源，反“四风”力度空前，反腐败雷霆万钧，机构改革大刀阔斧，军队改革体系重构，“三大攻坚战”成效卓著，大国外交开创新局……所有这一切都表明，如果没有斗争精神、斗争本领，党和国家事业就不可能取得全方位、开创性成就，就不可能发生深层次、根本性变革！
	犯其至难，方能图其至远。中华民族伟大复兴，绝不是轻轻松松、敲锣打鼓就能实现的，在前进道路上我们面临的风险考验只会越来越复杂，甚至会遇到难以想象的惊涛骇浪，实现伟大梦想必须进行伟大斗争，发扬斗争精神，坚定斗争意志，骨头要硬，敢于出击，敢战能胜。正如习近平总书记强调的，凡是危害中国共产党领导和我国社会主义制度的各种风险挑战，凡是危害我国主权、安全、发展利益的各种风险挑战，凡是危害我国核心利益和重大原则的各种风险挑战，凡是危害我国人民根本利益的各种风险挑战，凡是危害我国实现“两个一百年”奋斗目标、实现中华民族伟大复兴的各种风险挑战，只要来了，我们就必须进行坚决斗争，毫不动摇，毫不退缩，直至取得胜利。
	回望历史，中国人民深知红色政权来之不易、新中国来之不易、中国特色社会主义来之不易。面向未来，中国人民的意志坚如磐石，任何人任何势力企图通过霸凌手段把他们的意志强加给中国都必定要失败，中国前进的方向不容改变，中国人民创造自己美好生活的努力不容阻挠，中华民族走向伟大复兴的历史脚步不可阻挡。中国人民有足够的决心和意志、有足够的底气和能力、有足够的智慧和勇气进行具有许多新的历史特点的伟大斗争，“把一个个坎都迈过去，什么陷阱啊，什么围追堵截啊，什么封锁线啊，把它们通通抛在身后”，向着中华民族伟大复兴的光辉彼岸奋勇前进！"
坚守发展定力也是一种担当,2020-09-08,"据近日的一则报道，西部某县结合实际探索发展黑山羊养殖，打造特色旅游产业，走出了一条可持续发展之路。恰好几年前笔者到该县采访，县领导说：周边地区争相上马太阳能项目，家家户户参与，我们跟不跟？权衡再三，县里决定不盲目跟风，按自己的工作安排培育本地产业。
	后来的情况是，一些地方因投资规模过大且电网并网不顺，导致太阳能项目不可持续，不仅虚耗了本就稀缺的发展资源，也错过了培育本土优势产业的宝贵时间窗口。
	由此看来，该县当初立足实际，走了一条平稳务实的发展路子。仓促上马新项目，短期利益诱人，干还是不干，这可能是地方领导干部施政过程中经常面临的选择。上不上项目、上什么项目，清晰地照见一个地方的政绩观。一味地大干快上并非真担当，把握发展规律，科学理性决策，守住发展底线，立足当地实际，选好发展项目，有所为有所不为，才是真担当。
	实际工作中，如果不能坚守定力，盲目跟风，政策制定势必失去科学性，发展方向就会跑偏，到头来往往要付出更大代价。比如脱离实际大拆大建，“赶农民上楼”，搞不切实际的城市化，就可能激化矛盾、影响稳定；疫情影响带来发展压力，一些地方放松了环保要求，冲击了生态环保底线，一旦造成污染，重新治理成本太高；还有极少数地方风险防控底线失守，寅吃卯粮，留下一系列债务隐患和其他问题……
	当前决胜全面小康、决战脱贫攻坚任务繁重，压力重重考验着基层领导干部的定力。关键时刻，领导干部更要敢担当、善作为，只有深入贯彻新发展理念，守住发展底线，把握好群众眼前利益和长远利益的统一，才能做到于危机中育新机、于变局中开新局。
	不走资源消耗的老路，会倒逼高质量发展；充分考虑民意民生，就需要更扎实的市场调研和实地勘察；防范金融风险，就不能盲目铺摊子，得确保财政资金每一分都用在紧要处……坚守定力，要求领导干部在关键时候稳得住心神、立得住脚跟，有“功成不必在我”的精神境界和“功成必定有我”的历史担当，不急求“显绩”、多创造“潜绩”，真正做到为官一任、造福一方。
	说到底，坚守定力，守的是一颗初心和公心。心中有戒，才能行之有界。相反，突破底线，就会脚踩红线，甚至突破纪法的安全线。广大党员干部应时刻树立底线思维，在实践中不断校正政绩观，坚持忠诚、干净、担当的底色不褪，为党和人民再立新功。"
