title,date,body
为长远计 为子孙谋(红船观澜・担当作为系列谈(14)),2020-12-08,"此前，在西部某市采访，当地经济不发达但矿产丰富。主政的领导并没有急于开采矿产资源，而是采取严格的生态保护措施，他说，认真贯彻落实习近平总书记“绿水青山就是金山银山”重要理念，相信能找到更高质量的发展路子，给后人留点家底，保住绿水青山。
	寥寥数语，道出了正确的政绩观。资源可以换来GDP，但在一些地方，代价往往是过度开发，突破环境资源承载力，给后续发展带来隐患。过度开发造成的治理成本还很可能远远大于一时的收益。诚然，与开挖“金山银山”相比，在保住绿水青山中寻找发展之策，要求更高；与寅吃卯粮上项目相比，静水流深谋发展更为难得。有时选择留下发展资源，还要承受政绩考核的压力、潜绩不彰的压力。如此还愿意埋头做潜绩，甘当铺路人，更显领导干部的担当。
	善于留下发展资源也需要智慧，这考验领导干部的治理能力。留下发展资源不是懒政怠政，而是有所为有所不为；留下发展资源不是不要发展，而是在舍得之间有定力。善于留下发展资源，就要具备战略眼光，立足实际，把握规律，规划长远，探索新的发展路子。比如，有的地方风景秀美却生态脆弱，发展旅游业便是出路。善于留下发展资源，还要做好配套工作，为群众的生产生活想办法、找出路。比如，封山、禁渔后， 伐木工变成护林员，打鱼者变成护渔员……
	领导干部手握权力，必须始终坚持以人民为中心的发展思想，为长远计，为子孙谋。从这个角度说，适当留下发展资源、给后人留家底，是对历史负责、对人民负责的生动实践，决定着发展的质量、效益和后劲，关系着广大群众的获得感、幸福感、安全感能否更加充实、更加持久、更有保障。
	党的十九届五中全会审议通过“十四五”规划建议，对贯彻新发展理念、迈向高质量发展作出新部署、新要求。广大党员干部要认真学习贯彻落实全会精神，既奋发有为，激发发展活力；又打破定势，保持战略定力，勇于书写高质量发展的新篇章。"
人民日报评论员：像优秀共产党员那样去奋斗,2020-12-04,"12月3日，党中央决定，授予周永开、张桂梅同志和追授于海俊、李夏、卢永根、张小娟、加思来提・麻合苏提同志“全国优秀共产党员”称号。榜样的力量是无穷的，这力量温暖人、鼓舞人、启迪人。7位同志获此光荣称号，必将激励和引导广大党员、干部忠实践行习近平新时代中国特色社会主义思想，不忘初心、牢记使命，勇于担当、砥砺奋进，努力创造无愧于时代、无愧于人民、无愧于历史的业绩。
	习近平总书记指出，向先进典型学习，可学者多矣！最关键的是要学精神、学品质、学方法。周永开等7位同志是在“不忘初心、牢记使命”主题教育中涌现出来的共产党员的先进典型，他们秉持理想信念、保持崇高境界、坚守初心使命、敢于担当作为，以实际行动诠释了共产党人的崇高精神和优秀品质。周永开和卢永根同志一辈子听党话、跟党走，始终如一坚守“党是一生的追随”“把一切献给党和祖国”的初心誓言；张桂梅同志把全部身心投入到边疆民族地区教育事业和儿童福利事业，为孩子们留住用知识改变命运的机会；于海俊、李夏和张小娟同志坚守在艰苦偏远地区，奋战在党和人民最需要的地方，执着奉献直至献出自己宝贵的生命；加思来提・麻合苏提同志坚定站在反分裂斗争一线，旗帜鲜明跟党走，一直战斗到生命最后一刻。他们在不同的岗位上，干出了共产党员应有的好样子，赢得了人民群众的信任与爱戴；他们如同一面面旗帜，共同展现着新时代的精神力量。
	“崇尚英雄才会产生英雄，争做英雄才能英雄辈出。”标杆是干出来的，学习标杆就要在干中学。广大党员、干部要以先进典型为镜子，找参照、找差距，要像他们那样牢记宗旨、心系群众，始终保持在思想上行动上对党忠诚、信念坚定；像他们那样苦干实干、担当奉献，越是艰险越向前；像他们那样严于律己、坦荡无私，永葆共产党人的政治本色。学习标杆还要在知行合一上下功夫，把他们的崇高精神和优良作风内化于心、外化于行，真正像他们那样去奋斗。人人起而行之，人人奋勇争先，就一定能汇聚成干事创业的时代洪流，把我们的伟大事业不断推向前进。
	伟大时代呼唤伟大精神，崇高事业需要榜样引领。站在“两个一百年”奋斗目标的历史交汇点上，党的十九届五中全会为中国发展擘画了波澜壮阔的新图景。在全面建设社会主义现代化国家的新征程上，一定会涌现出更多优秀先进典型，引领带动广大干部群众，汇聚起奋发前行的磅礴力量。让我们学习先进、争当先进，将初心融进灵魂，把使命扛在肩上，振奋精神，只争朝夕，敢字为先，干字当头，共同为实现中华民族伟大复兴的中国梦不懈奋斗！"
责任在肩，苦干实干（红船观澜・担当作为系列谈(13)）,2020-12-01,"当前，扎实做好“六稳”工作、全面落实“六保”任务，确保如期打赢脱贫攻坚战，确保如期全面建成小康社会，无论哪一项目标任务都不轻松，都需要广大党员干部进一步担当作为，尤其面对严峻复杂的形势，战胜前进道路上各种风险挑战，更要有一股压不倒、打不垮的精神。
	　　急事难事看担当。如何应对困难和挑战，照见党员干部的境界和担当。古人讲“当官避事平生耻，视死如归社稷心”，作为党员领导干部更应分得清荣与耻，对得住自己的初心。改革进入深水区，加上新冠肺炎疫情的冲击，我们要面对和处理的难事更多、工作难度更大，尤其需要干部担当作为，敢啃“硬骨头”。
	　　越是艰险越向前。今年以来，在疫情防控阻击战中，在抗洪抢险救灾中，在人民生命财产安全受到极大威胁的时刻，广大党员干部义无反顾、向险而行，把担当写在疫情防控斗争一线，写在誓死守护的大堤上。“我是党员我先上”“洪水不退，我们不撤”……铿锵有力的话语，展现出党员干部把人民利益放在至高无上位置的赤子情怀。战风险、渡难关，党员干部就要有那么一股气和劲，以雄健的精神涉险滩、爬陡坡，带领群众攻下一个个“娄山关”“腊子口”，走好新时代的长征路。
	　　实现伟大梦想，必须进行伟大斗争，中华民族伟大复兴绝不是轻轻松松、敲锣打鼓就能实现的，党员干部必须保持艰苦奋斗、真抓实干的状态。当前，“十四五”规划建设的宏伟画卷即将铺展开来，我们将开启全面建设社会主义现代化国家新征程。科学把握新发展阶段，坚定贯彻新发展理念，积极构建新发展格局，唯有苦干实干，才能不断取得新进展。也只有干出样子、干出成绩，才能在人民心中有位置有分量。焦裕禄“拼上老命大干一场，决心改变兰考面貌”；谷文昌带领干部群众苦干14个春秋，将荒岛变绿洲；廖俊波扑下身子、背石上山，打拼到生命最后一刻……为人民苦与累，人民不会忘记，历史定会铭记。
	　　责任在肩，苦干实干。站在“两个一百年”奋斗目标的历史交汇点上，我们要在危机中育新机、于变局中开新局，唯有时刻掂量肩负的责任，发扬“天行健，君子以自强不息”的顽强斗志，坚定不移办好自己的事，在攻坚克难、改革创新中奋勇前进。"
