title,date,body
党建引领社区治理现代化,2020-10-09,"●把党的全面领导落实到城市最基层，把党建引领基层治理延伸到城市最末端，把党组织领导下的居民组织推进到城市最前沿，切实把党的组织优势、制度优势转化为治理优势和治理效能
	●坚持以党建为引领，健全完善体制机制，着力构建区域统筹、条块协同、上下联动、共建共享的基层治理格局
	基层治理是国家治理的基石。习近平总书记2016年视察宁夏时强调，要完善基层治理体系、增强基层治理能力，以党的基层组织建设带动其他各类基层组织配套建设，全面提高基层政权建设水平。贯彻习近平总书记重要讲话精神，银川市坚持加强党建引领社区治理，着力把党的全面领导落实到城市最基层，把党建引领基层治理延伸到城市最末端，把党组织领导下的居民组织推进到城市最前沿，切实把党的组织优势、制度优势转化为治理优势和治理效能。
	优化组织体系，提升基层组织力。党的力量来自组织，党的全面领导、党的全部工作要靠党的坚强组织体系去实现。推进城市基层党建引领社区治理现代化，必须把建设上下贯通、执行有力的组织体系作为关键，不断优化设置、织密网络、建强组织。纵向上，调整优化社区党组织设置，构建“社区党委（党总支）+网格（居民区）党支部+楼栋（院落）党小组”的社区组织链条。在社区成立党委兜底管理辖区商圈、楼宇、小微企业和社会组织党建工作，根据党员数量因地制宜设立网格（居民区）党组织，通过单独建或联合建的方式组建楼栋党小组。横向上，全面推行社区党组织书记、居委会主任“一肩挑”和社区“两委”班子交叉任职，在街道成立综合党委统筹管理辖区非公经济组织和社会组织党建工作，加大在业主委员会、物业服务企业、新兴经济组织中组建党组织力度，实行社区、物业、网格、业委会等党组织负责人交叉任职、双向进入，构建“红色业委会―红色物业―红色新兴经济组织”的横向治理体系。网格上，统筹考虑地域、人口等因素，合理优化调整社区及网格设置，整合党建、综治、综合执法等资源力量，打造集基层党建、社会治理、民生服务为一体的“全科网格”。
	优化人员素质，提升队伍带动力。习近平总书记指出，“逐步建立一支素质优良的专业化社区工作者队伍”。要以政治觉悟高、专业素质优、服务能力强、群众评价好为标准，着力在队伍建设上下功夫，为社区治理提供坚强有力的人才队伍支撑。选优配强街道社区人员队伍。选准用好街道党工委书记、副书记，增设组织委员，严格落实社区党组织书记县级备案管理制度，拓宽社区党组织书记选拔渠道。将社区工作者队伍建设纳入市县两级人才发展规划，加大在社区工作者中培养发展党员力度，把优秀的社区工作者纳入社区“两委”后备队伍。加强专职网格员队伍建设，按照“一格一员”标准，面向社会公开招聘，并适当向党员倾斜，确保三年内全市专职网格员覆盖率达到100%。健全社区工作者管理服务机制。实行社区“两委”成员职数动态管理和资格联审机制，加大社区和网格（居民区）党组织负责人培训力度。畅通社区工作者晋升通道，努力让社区工作者有劲头有奔头。建强激活党员先锋队伍。建立居民党员“直接管”、在职党员“双重管”、流动党员“跟进管”的分类管理机制，通过推行机关企事业单位党组织和在职党员到社区“双报到、双报告”制度，在职党员服务社区表现情况积分制管理等方式，引导党员积极参与基层治理、发挥先锋模范作用。
	优化治理机制，提升多元共治力。习近平总书记指出，“创新社会治理体制，把资源、服务、管理放到基层，把基层治理同基层党建结合起来。”要坚持以党建为引领，健全完善体制机制，着力构建区域统筹、条块协同、上下联动、共建共享的基层治理格局。完善社区自治机制。深化“四议两公开”、民主议政日等议事决策制度，依法依规稳妥开展非户籍常住居民和党员参加社区“两委”试点，健全党组织领导下居民有序参加自治事务的体制机制。加强社区党组织对业主委员会组建的指导，注重推荐符合条件的社区党员、网格员、优秀志愿者进入业主委员会。建立上下联动机制。持续深化街道社区管理体制改革，健全“1+4+N”的“街道吹哨、部门报到”机制。在基层面临重大突发事件、公共卫生安全事件等“战时”状态时，市、县（市）区各类机关事业单位以结对包抓形式下沉社区协助开展工作，着力提升基层党委统筹调度、协调各方的能力。搭建共商共治机制。建立完善街道、社区、居民小区三级党建联席会议制度，运用“一书三单”（共驻共建协议书、共治资源清单、治理需求清单、服务项目清单）研究解决辖区内党建工作、社会治理、环境整治、民生服务等重要事项，推进共治共建共享。
	优化基础保障，提升治理承载力。党的十九届四中全会指出，要推动社会治理和服务重心向基层下移，把更多资源下沉到基层，更好提供精准化、精细化服务。落实这一要求，必须把更多资源资金投放基层，权责对称下沉基层，政策项目倾斜基层，确保在基层有人管事、有钱办事、有场所议事、有心气干事。明确权责边界。逐级明确市、县（市）区、街道、社区党组织及市县有关职能部门职责边界，健全与职责相适应的街道社区考评体系，赋予街道社区对常驻机构、下沉部门、辖区部门一定比例的考核赋分权和建议权，督促各类治理力量积极参与社区治理。拓展阵地功能。严格落实《银川市关于强化政治功能建好管好用好基层党组织阵地的实施办法（试行）》，统筹整合基层各类阵地资源，创新活动载体，完善“五室一站”基本功能，使社区党建阵地真正成为党员活动的中心、党员教育的学校、为民服务的窗口、群众议事的平台、志愿服务的驿站、文明实践的舞台。加大投入保障。加强社区党组织阵地和党建经费保障，加大社区为民服务发展专项资金投入，提高社区工作者待遇，调动社区工作者的积极性主动性。
	(作者系银川市委常委、组织部部长、统战部部长）"
一线视角：追根溯源整治形式主义,2020-10-09,"不久前，习近平总书记在湖南考察时强调，“要密切联系群众，经常深入基层、深入实际，把工作抓到群众心坎上，力戒形式主义、官僚主义。”今年4月，中共中央办公厅印发通知，强调持续解决困扰基层的形式主义问题。当前，我国发展面临一些风险挑战，再叠加新冠肺炎疫情影响，做好经济社会发展工作难度加大，更加需要以优良作风狠抓工作落实。
	经过严厉整治，特别是去年设立“基层减负年”，今年持续开展专项整治，困扰基层的形式主义、官僚主义问题得到遏制，取得明显成效。作风建设永远在路上。务必清醒看到，形式主义、官僚主义败坏党风政风，损害党和政府形象，破坏党群干群关系，必须旗帜鲜明反对，坚决彻底纠治。好作风和好习惯的形成需要一个过程，只有不停清除积弊顽疾，锲而不舍久久为功，才能铲除形式主义、官僚主义的滋生土壤，营造求真务实、清正廉洁的新风正气。
	笔者注意到，形式主义在一定区域、一定范围内仍然存在。在基层采访，一些基层干部反映，“上班时间是在开会、整材料，加班时间干工作”“留痕过度、检查督查过频、材料过多的现象，还时有发生”。在某个基层办事大厅，各种工作图表、汇报材料整齐排列，摆了满满一桌子。“这地方领导来得不少，材料得常年准备着。”一名基层干部介绍，“领导来了都要看这些，我们不准备也不行。”这些过度留痕、过度检查问题，正是典型的形式主义。这也提示我们，反对形式主义，必须结合实际日常工作，必须注重上下级联动。
	坚持一级做给一级看，抓好本级带下级，是我们党改进作风的一条重要经验。整治困扰基层的形式主义问题，必须从上级领导机关和领导干部抓起改起。上级部门调查研究深入实际、务求实绩，基层搞花架子和“材料政绩”就很难蒙混过关。上级机关和领导干部多深入基层一线、深入群众中间，扎实调研，全面、准确掌握基层的真实情况，深入了解基层群众的所想所盼，这既是保证调查研究科学准确全面的必然要求，也可以推动基层谋实事、务实绩。
	整治形式主义需要“追根溯源”，到底是哪些工作环节不切实际、不接地气，到底是哪项考核容易导致过度留痕、过度检查，到底哪些会议可以合并开、哪些会议没有必要开……只有查清问题本源才能厘清责任事项、落实减负要求。明确整治责任主体、责任目标，并严格考核监督，才能实现对形式主义的标本兼治。
	有没有形式主义，基层干部群众最有发言权。从决策制定到政策执行，再到考核监督，都需要注重听取基层干部群众意见建议，了解具体落实情况。坚持以人民为中心谋划各项工作，充分调动广大党员、干部的积极性主动性创造性，一定能为决胜全面建成小康社会、决战脱贫攻坚提供坚强作风保证。
	（作者为本报山西分社记者）"
思想纵横：激扬我们的雄心壮志,2020-09-30,"习近平总书记指出：“我们这么大一个国家，就应该有雄心壮志。”当前，全面建成小康社会的宏伟目标即将如期实现，全面建设社会主义现代化国家的新征程即将顺利开启。置身实现“两个一百年”奋斗目标的历史交汇期，我们必须激扬雄心壮志。
	志向对一个人、一个国家、一个民族的发展至关重要。一个人要有所成就，就不能没有志向。一个国家、一个民族也是如此。新中国成立以来，我们之所以能创造经济快速发展和社会长期稳定“两大奇迹”，就是因为我们国家有着自己的雄心壮志。现在，我国处于近代以来最好的发展时期，世界处于百年未有之大变局，两者同步交织、相互激荡。在这样一个关键时期，我们必须统筹中华民族伟大复兴战略全局和世界百年未有之大变局，不断激扬雄心壮志。
	激扬雄心壮志，可以防止骄傲自满。现实表明，如果沉醉于自己的“好”、躺在过去的功劳簿上，就难以做到“更好”、创造新的业绩。改革开放40多年来，我们用几十年时间走完了发达国家几百年走过的工业化历程。在中国人民手中，很多不可能成为了可能。特别是党的十八大以来，我们啃下了不少硬骨头，闯过了不少激流险滩，改革呈现全面发力、多点突破、蹄疾步稳、纵深推进的局面，推动党和国家事业取得历史性成就、发生历史性变革。今天，我们迎来了全面建成小康社会决战决胜的历史时刻，中华民族千百年来的期盼即将变成现实。我们党带领人民接续奋斗的历程波澜壮阔、成就举世瞩目，当然值得自豪。但是，如果党员干部因为取得的成绩、得到的赞扬而骄傲自满，安心躺在功劳簿上，安于现状、不思进取，就会影响我们实现更宏伟的目标。中国共产党立志于中华民族千秋伟业，我们要在全面建成小康社会的基础上，乘势而上开启全面建设社会主义现代化国家新征程。广大党员干部必须激扬雄心壮志，决不能忘记光荣的历史使命、宏伟的奋斗目标，启航新征程、扬帆再出发。
	激扬雄心壮志，可以防止徘徊彷徨。“志行万里者，不中道而辍足”。有志行走万里的人，绝不会中途徘徊彷徨、停止前行的脚步，因为他们深知“行百里者半九十”。中华民族伟大复兴，绝不是轻轻松松、敲锣打鼓就能实现的，前进的道路上必然会遇到各种风险挑战，甚至有难以想象的惊涛骇浪。我们现在所处的，是一个船到中流浪更急、人到半山路更陡的时候，是一个愈进愈难、愈进愈险而又不进则退、非进不可的时候。特别要看到，新冠肺炎疫情全球大流行使世界百年未有之大变局加速演进，世界进入动荡变革期。今后一个时期，我们将面对更多逆风逆水的外部环境，必须做好应对一系列新的风险挑战的准备。越是在这种时候，越应该激扬雄心壮志，勇于开顶风船，善于转危为机，绝不能有丝毫犹豫不决、徘徊彷徨。
	习近平总书记指出：“一个民族之所以伟大，根本就在于在任何困难和风险面前都从来不放弃、不退缩、不止步，百折不挠为自己的前途命运而奋斗。”实现中华民族伟大复兴是近代以来中华民族最伟大的梦想。风云激壮志，雄心在四方。一时的成绩、一时的困难，都不会让我们停下脚步，中华民族伟大复兴的中国梦必将在我们永不停歇的奋斗中得以实现。"
人民观点：善于改革突破，积势蓄力新征程,2020-09-30,"坚定不移深化改革、扩大开放，加速构建新发展格局，就能为跨越坎坷赋予“乱云飞渡仍从容”的回旋韧性，为开启全面建设社会主义现代化国家新征程积势蓄力
	积厚成势、蓄势待发、谋势而动，考验着把握规律的智慧、洞察世界的眼界和果断决策的魄力
	 
	《关于推进对外贸易创新发展的实施意见》《关于新时代振兴中西部高等教育的若干意见》《关于进一步规范医疗行为促进合理医疗检查的指导意见》……前不久，中央全面深化改革委员会第十五次会议审议通过了一系列方案。习近平总书记强调：“要继续用足用好改革这个关键一招，保持勇往直前、风雨无阻的战略定力，围绕坚持和完善中国特色社会主义制度、推进国家治理体系和治理能力现代化，推动更深层次改革，实行更高水平开放，为构建新发展格局提供强大动力。”
	当今世界正经历百年未有之大变局，新冠肺炎疫情使大变局加速演进，国际环境日趋复杂，经济全球化遭遇逆流，一些国家单边主义、保护主义盛行，我们必须在一个更加不稳定不确定的世界中谋求我国发展。我国已进入高质量发展阶段，经济发展前景向好，同时发展不平衡不充分问题仍然突出，实现高质量发展还有一些短板弱项。“必须发挥好改革的突破和先导作用，依靠改革应对变局、开拓新局，坚持目标引领和问题导向，既善于积势蓄势谋势，又善于识变求变应变”，习近平总书记的重要指示为推动改革更好服务经济社会发展提供了重要方法论。
	风险挑战越是严峻复杂，越要坚定各方面深化改革的决心和信心。从经济下行的“压力测试”，到疫情汛情的“突发加试”，再到外部环境的“逆风逆水”，我们之所以能够在疫情防控和经济恢复上都走在世界前列，在于我们有百年大党淬炼的强大优势、70多年社会主义建设形成的宝贵经验、40多年改革开放积蓄的雄厚基础，还在于这些年，全面深化改革从夯基垒台、立柱架梁，到全面推进、积厚成势，再到系统集成、协同高效，不断在新起点上实现新突破。坚定不移深化改革、扩大开放，加速构建新发展格局，就能为跨越坎坷赋予“乱云飞渡仍从容”的回旋韧性，为开启全面建设社会主义现代化国家新征程积势蓄力。
	形势在变、任务在变、工作要求也在变，领导干部必须善于识变求变应变。近段时间以来，湖北出台“1+N”系列文件，立足推动疾病预防控制体系改革、公共卫生体系建设；浙江加大“放管服”改革力度，既助企纾困又激发市场主体活力；广东要求健全应急物资保障制度体系，推动应急物资储备中心地级市以上全覆盖……各地密集打出深化改革“组合拳”，既是因应变化、立足当下的应对之策，又是危中寻机、着眼长远的主动作为。改革由问题倒逼而生，又在解决问题中深化。瞄准经济社会运行中不断变化的实际问题，改革就有了靶心和方向。
	下好化危为机“先手棋”、打好转型升级“主动仗”，领导干部也要善于积势蓄势谋势。积厚成势、蓄势待发、谋势而动，考验着把握规律的智慧、洞察世界的眼界和果断决策的魄力。应对“三期叠加”，如何推进数字经济、智能制造等战略性新兴产业？统筹“两个大局”，如何加快构建新发展格局？面对第二个百年奋斗目标，如何在全面建成小康社会的基础上乘势而上？实现长远、全局目标，解决结构性、体制性、周期性问题，要在战略上布好局、在关键处落好子，加快推进有利于提高资源配置效率的改革，有利于提高发展质量和效益的改革，有利于调动各方面积极性的改革。使各项改革朝着加快形成新发展格局聚焦发力，才能将发展的主动权牢牢把握在自己手中。
	“勇于自我革命，是我们党最鲜明的品格，也是我们党最大的优势。”改革开放之所以能成为决定当代中国命运的关键一招，拥有一支能够自我净化、自我完善、自我革新、自我提高的队伍至关重要。全面深化改革必须抓住“关键少数”，领导干部冲破思想观念障碍、突破利益固化藩篱，练就改革创新本领、破除因循守旧弊病，磨砺担当尽责的“头雁精神”、避免推诿塞责的“鸵鸟心态”，方能确保改革在愈进愈难之际步步前进，在愈进愈险时履险如夷。
	一路风雨兼程，一路披荆斩棘，中华人民共和国即将迎来71华诞。71年来，我们创造了举世罕见的经济快速发展奇迹和社会长期稳定奇迹。“中华民族历史上经历过很多磨难，但从来没有被压垮过，而是愈挫愈勇，不断在磨难中成长、从磨难中奋起。”这种精神印刻在抵御外侮、实业救国的奋斗中，磨砺于抗击疫情、抗洪救灾的淬炼里，更闪耀于深化改革、锐意创新的征程上。以更大的力度全面深化改革，我们就一定能在危机中育新机、于变局中开新局，为中华民族更美好的明天蓄势加劲。"
党建评：年轻干部要在奋斗中争创“第一等工作”,2020-09-29,"培养选拔优秀年轻干部是一件大事，关乎党的命运、国家的命运、民族的命运、人民的福祉，是百年大计。
	信仰是实现目标的动力支撑，要夯实信仰之基、掌握思想武器、照亮奋斗之路。习近平新时代中国特色社会主义思想是指引年轻干部健康成长的思想，年轻干部要把学习贯彻习近平新时代中国特色社会主义思想作为重中之重，在学懂弄通做实上下功夫，把自己摆进去、把职责摆进去、把工作摆进去，做到知信行合一、学思用贯通。要特别注重加强思想淬炼，接受党的创新理论教育和严格党性教育，做到真学真懂真信真用，在学思践悟中增强“四个意识”，坚定“四个自信”，做到“两个维护”，切实解决好世界观、人生观、价值观这个“总开关”问题。年轻干部只有抱有坚定的信仰，才能坚持正确政治方向，做到“风雨不动安如山”。
	软肩膀挑不起硬担子，打铁还需自身硬。提升硬本领，就要坚持广学，拓宽知识宽度，提升站得高的基础。坚持深思，拓深学习深度，探寻看得深的源泉。年轻干部要有足够本领来接班，加强学习、积累经验、增长才干，自觉向实践学习、拜人民为师。要自觉发扬“不待扬鞭自奋蹄”的精神，树立善于学习就是善于进步的观念，把学习作为首要任务，心无旁骛、如饥似渴地求知问学，把成长的基石打深打牢。当前，中华民族伟大复兴的战略全局与世界百年未有之大变局形成历史性交汇，相互作用、相互激荡。年轻干部要时刻牢记两个大局，在两个大局下学真知、悟真谛、长本领，不断提升自我，克服本领恐慌。
	担当意味着尽责。中国特色社会主义进入新时代，我们比历史上任何时期都更接近、更有信心和能力实现中华民族伟大复兴。新时代注定是属于奋斗者的时代，新时代的年轻干部既面临着难得的人生际遇，也肩负着光荣的时代使命，拥有更多实干出彩、梦想成真的机会。年轻干部要做起而行之的行动者、不做坐而论道的清谈客，当攻坚克难的奋斗者、不当怕见风雨的泥菩萨。要在脚踏实地的同时仰望星空，在登高望远中放大格局，做到“既能想大问题，又能做小事情”，在重大斗争中增强斗争勇气、积累斗争经验、提高斗争本领，担起时代之责。
	为政之道，修身为本。做人做事第一位的是崇德修身，新时代年轻干部一定要强化自我修炼、自我约束、自我改造，自觉践行社会主义核心价值观，做到品德润身、公德善心、大德铸魂。人生之路很长，但每一步又很短，踩空了就不可能重来。年轻干部正处于成长进步的黄金期，要行得端、走得正，既要保持“初生牛犊不怕虎”的拼劲干劲闯劲，又要始终保持敬畏之心，敬畏自然、敬畏生命、敬畏真理、敬畏法纪、敬畏正义，在敬畏中保持清醒冷静。要稳重自持、坚定自励、正气充盈，主动承担起对国家民族的责任，守住气节操守，在廉洁上守住底线，在大是大非问题上坚持原则。"
始终保持进取心,2020-09-29,"到东北地区采访，遇到一位老支书。他当了一辈子村干部，工作一直一丝不苟、有条不紊，但近年来明显觉得力不从心。脱贫攻坚、乡村振兴、农村改厕……每项新任务，他都要花很大精力学习，才勉勉强强说出个所以然，至于怎么干则更多依靠年轻人出主意、想办法。
	“活到老，学到老，还有三分没学到”。老支书没明说，但话里话外透着四个字：本领恐慌。
	早在1939年，毛泽东同志就指出，我们队伍里边有一种恐慌，不是经济恐慌，也不是政治恐慌，而是本领恐慌。
	习近平总书记强调，只有加强学习，才能增强工作的科学性、预见性、主动性，才能使领导和决策体现时代性、把握规律性、富于创造性，避免陷入少知而迷、不知而盲、无知而乱的困境，才能克服本领不足、本领恐慌、本领落后的问题。
	干部要担当，既有想不想的问题，还有会不会、能不能的问题。实际工作中，干部不敢担当作为，有不少是不会或不能的问题。看不懂形势、理不清思路、把不准方向，自然就迷茫焦虑不知所措，如何敢担当？要么硬着头皮上，面对新工作一筹莫展，自然很难有起色；还有的是没有金刚钻硬揽瓷器活，看似担当了，实则乱作为，造成工作失误，甚至激化矛盾，带来不可估量的损失。
	能力的强弱，直接决定着决策水平、工作成色。广大党员干部应该把自身能力提高放在更加重要的位置，积极向书本学习，向实践学习，向群众学习，不断提升能力素质，善学善谋、善作善成。有的干部认为自己工作年头长、经验丰富，能力不是问题。实际上，经验与能力之间并不能画等号。社会发展日新月异，不同时期、不同阶段对能力素质的要求也不尽相同。在奔涌向前的时代大潮前，我们要始终保持一颗好奇心和进取心，与时俱进、久久为功，加强学习，努力拼搏，不断提升能力素质。
	宽肩膀才能扛起硬担子。我们一方面要鼓励干部努力提升素质，练就过硬本领；另一方面也要进一步推动形成能者上、庸者下、劣者汰的选人用人导向，通过严格标准、完善制度、规范程序等一系列举措，努力让有能力敢担当的人脱颖而出，激励更多的人担当作为。
	绳短不能汲深井，浅水难以负大舟。当今世界正经历百年未有之大变局，广大党员干部只有不断提升能力水平，才能准确识变、科学应变、主动求变。保持“本领恐慌”的危机感和时不我待的使命感，积极查找不足，努力增长才干，才能跟上时代的节拍，展现更大的作为。"
